{
  "contract_id": "experiment-config",
  "schema_version": "1.0.0",
  "experiment_id": "fixture-reference-run",
  "initial_capital": 1000000,
  "currency": "CNY",
  "dataset_id": "fixture-daily-2026-07-29-aaaaaaaaaaaa",
  "universe_id": "fixture-csi800-pit/v1",
  "benchmark": "fixture-benchmark",
  "random_seed": 20260729,
  "windows": {
    "development": {"start": "2025-01-01", "end": "2025-06-30"},
    "validation": {"start": "2025-07-01", "end": "2025-12-31"},
    "final": {"start": "2026-01-01", "end": "2026-06-30"}
  }
}
